{
  "$schema": "http://json-schema.org/draft-07/schema#",
  "title": "unified_evidence",
  "description": "Output of the Evidence Aggregator (P4). Consolidated, deduplicated, and enriched evidence from all forensic tools.",
  "type": "object",
  "required": [
    "case_id",
    "generated_at",
    "tools_aggregated",
    "total_items",
    "evidence_items"
  ],
  "properties": {
    "case_id": {
      "type": "string",
      "description": "Case ID from case_context.json for audit trail"
    },
    "generated_at": {
      "type": "string",
      "description": "ISO 8601 timestamp when this aggregation was performed"
    },
    "tools_aggregated": {
      "type": "array",
      "items": { "type": "string" },
      "description": "List of tool names that were aggregated (e.g., ['volatility3', 'tshark', 'regripper'])"
    },
    "total_items": {
      "type": "integer",
      "description": "Total number of unique evidence items after deduplication"
    },
    "deduplication_stats": {
      "type": "object",
      "description": "Metadata on deduplication process",
      "properties": {
        "raw_items_before": {
          "type": "integer",
          "description": "Total items before deduplication"
        },
        "duplicates_removed": {
          "type": "integer",
          "description": "Number of duplicate items removed"
        }
      }
    },
    "evidence_items": {
      "type": "array",
      "items": {
        "$ref": "evidence_item.json"
      },
      "description": "Consolidated evidence array, sorted by severity (critical→low) then by confidence (high→low)"
    },
    "evidence_by_type": {
      "type": "object",
      "description": "artifact_id references grouped by evidence_type for quick lookup (resolve full objects from evidence_items)",
      "additionalProperties": {
        "type": "array",
        "items": { "type": "string" }
      }
    },
    "evidence_by_tool": {
      "type": "object",
      "description": "artifact_id references grouped by source_tool for provenance tracking (resolve full objects from evidence_items)",
      "additionalProperties": {
        "type": "array",
        "items": { "type": "string" }
      }
    },
    "evidence_by_machine": {
      "type": "object",
      "description": "artifact_id references grouped by machine_id for bulk analysis (resolve full objects from evidence_items)",
      "additionalProperties": {
        "type": "array",
        "items": { "type": "string" }
      }
    },
    "findings": {
      "type": "array",
      "description": "Cross-tool correlation findings such as same PID, same IP, same file, same timestamp, and exfiltration",
      "items": {
        "type": "object",
        "properties": {
          "item": { "type": "string" },
          "matches": {
            "type": "array",
            "items": {
              "type": "object"
            }
          },
          "confidence": { "type": "number" },
          "correlation_type": { "type": "string" },
          "finding": { "type": "string" },
          "what_confirmed_it": {
            "type": "array",
            "items": { "type": "string" }
          },
          "artifacts": {
            "type": "array",
            "items": { "type": "string" }
          },
          "source_tools": {
            "type": "array",
            "items": { "type": "string" }
          },
          "signal": { "type": "string" },
          "file": { "type": "string" },
          "destination": { "type": "string" },
          "timestamp": { "type": "string" },
          "bytes_transferred": { "type": "integer" }
        }
      }
    },
    "exfiltration_findings": {
      "type": "array",
      "description": "Subset of findings specifically flagged as likely exfiltration",
      "items": {
        "type": "object"
      }
    },
    "bulk_summary": {
      "type": "object",
      "description": "High-level summary that can be used by downstream bulk report consumers",
      "properties": {
        "machines_analyzed": { "type": "integer" },
        "machine_ids": {
          "type": "array",
          "items": { "type": "string" }
        },
        "findings_detected": { "type": "integer" },
        "exfiltration_findings": { "type": "integer" }
      }
    }
  }
}
